{
  "run_date": "2026-03-13",
  "counts": {
    "input_records": 10,
    "packets_created": 10,
    "packets_skipped_dedupe": 0,
    "packets_below_threshold": 0
  },
  "packets": [
    {
      "company": "Flosum",
      "contact": "CEO",
      "title": "Chief Executive Officer",
      "priority": "p1",
      "relevance_score": 92,
      "why_now_signal": "Flosum is actively hiring for Director, Revenue Operations, indicating immediate GTM systems and forecasting pressure.",
      "value_hypothesis": "A focused RevOps operating cadence can improve pipeline visibility, accelerate qualification, and increase forecast reliability within one quarter.",
      "primary_message": "Hi CEO—noticed Flosum is hiring for 'Director, Revenue Operations'. That usually signals a scale point where pipeline definitions, stage hygiene, and forecast ownership need to tighten quickly. I help teams install practical RevOps operating cadence that improves visibility and cuts cycle drag without heavy process overhead. If useful, I can share a focused 1-page teardown showing where your funnel likely leaks and a 30-day stabilization plan tied to conversion and forecast confidence.",
      "follow_up_48h": "Quick bump—if helpful, I can send a short RevOps scorecard tailored to the 'Director, Revenue Operations' mandate so your team can prioritize the highest-impact fixes first.",
      "cta": "Open to a 15-minute hiring conversation next week?",
      "value_artifact_suggestion": "Mini RevOps scorecard + 30-day pipeline stabilization plan.",
      "job_role": "Director, Revenue Operations",
      "job_url": "https://jobs.workable.com/view/37NN4SbPks2KKPRDYQBLFj/remote-director%2C-revenue-operations-in-united-states-at-flosum",
      "source": "reports/daily-job-hunt.md",
      "dedupe_key": "flosum|ceo|director, revenue operations"
    },
    {
      "company": "VulnCheck",
      "contact": "VP Revenue Operations",
      "title": "VP Revenue Operations",
      "priority": "p1",
      "relevance_score": 88,
      "why_now_signal": "VulnCheck is actively hiring for Revenue Operations Manager, indicating immediate GTM systems and forecasting pressure.",
      "value_hypothesis": "A focused RevOps operating cadence can improve pipeline visibility, accelerate qualification, and increase forecast reliability within one quarter.",
      "primary_message": "Hi VP Revenue Operations—noticed VulnCheck is hiring for 'Revenue Operations Manager'. That usually signals a scale point where pipeline definitions, stage hygiene, and forecast ownership need to tighten quickly. I help teams install practical RevOps operating cadence that improves visibility and cuts cycle drag without heavy process overhead. If useful, I can share a focused 1-page teardown showing where your funnel likely leaks and a 30-day stabilization plan tied to conversion and forecast confidence.",
      "follow_up_48h": "Quick bump—if helpful, I can send a short RevOps scorecard tailored to the 'Revenue Operations Manager' mandate so your team can prioritize the highest-impact fixes first.",
      "cta": "Open to a 15-minute hiring conversation next week?",
      "value_artifact_suggestion": "Mini RevOps scorecard + 30-day pipeline stabilization plan.",
      "job_role": "Revenue Operations Manager",
      "job_url": "https://www.linkedin.com/jobs/view/revenue-operations-manager-us-remote-at-vulncheck-4383284359",
      "source": "reports/daily-job-hunt.md",
      "dedupe_key": "vulncheck|vp revenue operations|revenue operations manager"
    },
    {
      "company": "Persado",
      "contact": "CRO",
      "title": "Chief Revenue Officer",
      "priority": "p1",
      "relevance_score": 90,
      "why_now_signal": "Persado is actively hiring for Head of Revenue Operations, indicating immediate GTM systems and forecasting pressure.",
      "value_hypothesis": "A focused RevOps operating cadence can improve pipeline visibility, accelerate qualification, and increase forecast reliability within one quarter.",
      "primary_message": "Hi CRO—noticed Persado is hiring for 'Head of Revenue Operations'. That usually signals a scale point where pipeline definitions, stage hygiene, and forecast ownership need to tighten quickly. I help teams install practical RevOps operating cadence that improves visibility and cuts cycle drag without heavy process overhead. If useful, I can share a focused 1-page teardown showing where your funnel likely leaks and a 30-day stabilization plan tied to conversion and forecast confidence.",
      "follow_up_48h": "Quick bump—if helpful, I can send a short RevOps scorecard tailored to the 'Head of Revenue Operations' mandate so your team can prioritize the highest-impact fixes first.",
      "cta": "Open to a 15-minute hiring conversation next week?",
      "value_artifact_suggestion": "Mini RevOps scorecard + 30-day pipeline stabilization plan.",
      "job_role": "Head of Revenue Operations",
      "job_url": "https://apply.workable.com/persado/j/4BC8AFDA01",
      "source": "reports/daily-job-hunt.md",
      "dedupe_key": "persado|cro|head of revenue operations"
    },
    {
      "company": "InRule",
      "contact": "RevOps Director",
      "title": "Director, Revenue Operations",
      "priority": "p2",
      "relevance_score": 80,
      "why_now_signal": "InRule is actively hiring for Revenue Operations Analyst, indicating immediate GTM systems and forecasting pressure.",
      "value_hypothesis": "A focused RevOps operating cadence can improve pipeline visibility, accelerate qualification, and increase forecast reliability within one quarter.",
      "primary_message": "Hi RevOps Director—noticed InRule is hiring for 'Revenue Operations Analyst'. That usually signals a scale point where pipeline definitions, stage hygiene, and forecast ownership need to tighten quickly. I help teams install practical RevOps operating cadence that improves visibility and cuts cycle drag without heavy process overhead. If useful, I can share a focused 1-page teardown showing where your funnel likely leaks and a 30-day stabilization plan tied to conversion and forecast confidence.",
      "follow_up_48h": "Quick bump—if helpful, I can send a short RevOps scorecard tailored to the 'Revenue Operations Analyst' mandate so your team can prioritize the highest-impact fixes first.",
      "cta": "Open to a 15-minute hiring conversation next week?",
      "value_artifact_suggestion": "Mini RevOps scorecard + 30-day pipeline stabilization plan.",
      "job_role": "Revenue Operations Analyst",
      "job_url": "https://www.linkedin.com/jobs/view/revenue-operations-analyst-salesforce-analytics-at-inrule-4385176379",
      "source": "reports/daily-job-hunt.md",
      "dedupe_key": "inrule|revops director|revenue operations analyst"
    },
    {
      "company": "Autodesk",
      "contact": "Head of GTM Operations",
      "title": "Head of GTM Operations",
      "priority": "p2",
      "relevance_score": 78,
      "why_now_signal": "Autodesk is actively hiring for Senior Business Operations Manager, indicating immediate GTM systems and forecasting pressure.",
      "value_hypothesis": "A focused RevOps operating cadence can improve pipeline visibility, accelerate qualification, and increase forecast reliability within one quarter.",
      "primary_message": "Hi Head of GTM Operations—noticed Autodesk is hiring for 'Senior Business Operations Manager'. That usually signals a scale point where pipeline definitions, stage hygiene, and forecast ownership need to tighten quickly. I help teams install practical RevOps operating cadence that improves visibility and cuts cycle drag without heavy process overhead. If useful, I can share a focused 1-page teardown showing where your funnel likely leaks and a 30-day stabilization plan tied to conversion and forecast confidence.",
      "follow_up_48h": "Quick bump—if helpful, I can send a short RevOps scorecard tailored to the 'Senior Business Operations Manager' mandate so your team can prioritize the highest-impact fixes first.",
      "cta": "Open to a 15-minute hiring conversation next week?",
      "value_artifact_suggestion": "Mini RevOps scorecard + 30-day pipeline stabilization plan.",
      "job_role": "Senior Business Operations Manager",
      "job_url": "https://www.linkedin.com/jobs/view/senior-business-operations-manager-at-autodesk-4383965557",
      "source": "reports/daily-job-hunt.md",
      "dedupe_key": "autodesk|head of gtm operations|senior business operations manager"
    },
    {
      "company": "Demandbase",
      "contact": "VP Sales Ops",
      "title": "VP Sales Operations",
      "priority": "p3",
      "relevance_score": 74,
      "why_now_signal": "Demandbase is actively hiring for Manager, Deal Desk, indicating immediate GTM systems and forecasting pressure.",
      "value_hypothesis": "A focused RevOps operating cadence can improve pipeline visibility, accelerate qualification, and increase forecast reliability within one quarter.",
      "primary_message": "Hi VP Sales Ops—noticed Demandbase is hiring for 'Manager, Deal Desk'. That usually signals a scale point where pipeline definitions, stage hygiene, and forecast ownership need to tighten quickly. I help teams install practical RevOps operating cadence that improves visibility and cuts cycle drag without heavy process overhead. If useful, I can share a focused 1-page teardown showing where your funnel likely leaks and a 30-day stabilization plan tied to conversion and forecast confidence.",
      "follow_up_48h": "Quick bump—if helpful, I can send a short RevOps scorecard tailored to the 'Manager, Deal Desk' mandate so your team can prioritize the highest-impact fixes first.",
      "cta": "Open to a 15-minute hiring conversation next week?",
      "value_artifact_suggestion": "Mini RevOps scorecard + 30-day pipeline stabilization plan.",
      "job_role": "Manager, Deal Desk",